{
  "eventId": "evt_enterprisebalancechanged_001",
  "eventType": "EnterpriseBalanceChanged",
  "schemaVersion": 1,
  "occurredAt": "2026-08-10T02:00:00Z",
  "publishedAt": "2026-08-10T02:00:01Z",
  "producer": "SYS-08",
  "environment": "DEV",
  "audience": [
    "SYS-01"
  ],
  "enterpriseId": "ent_contract_001",
  "aggregateType": "EnterpriseBalance",
  "aggregateId": "ent_contract_001",
  "aggregateVersion": 4,
  "traceId": "trace_contract_fixture_001",
  "causationId": null,
  "correlationId": "corr_contract_fixture_001",
  "idempotencyKey": "ENTERPRISE_BALANCE:ent_contract_001:4",
  "payload": {
    "enterpriseId": "ent_contract_001",
    "availableFen": 120000,
    "frozenFen": 3000,
    "withdrawingFen": 20000,
    "balanceVersion": 4,
    "lastLedgerEntryId": "le_contract_001",
    "changedAt": "2026-08-10T02:00:00Z"
  }
}
